Scheme Name,Category,Eligibility (Simplified),Official Link
PM-Kisan,Agriculture,Small and marginal farmers,https://pmkisan.gov.in/
Ayushman Bharat (PM-JAY),Health,Low-income families,https://dashboard.pmjay.gov.in/
Pradhan Mantri Awas Yojana,Housing,People with no permanent house,https://pmay-urban.gov.in/
Sukanya Samriddhi Yojana,Education/Girls,Parents of a girl child (under 10),https://www.indiapost.gov.in/
Atal Pension Yojana,Finance,All citizens (aged 18-40),https://www.npscra.nsdl.co.in/
